ID,Reviews,Review Analysis
1,genuine samsung mobile well packed pta approved i like it very beautiful mobile and hope it will be long lasting experience 1111 1111 mobile without mobile warranty card charger but seems good packing was not good delivery is pathatic bought 3 phones and all are new sealed pack non active and pta approved no warranty card but daraz official warranty claimed by seller 1111 orignal pta approved haiseal pack mob haiperfomance me mobile buhat zbrdast haiscren resulation b buhat best haijo b purchase karna chahty hai eyes close kar k order kar dy original samsung a14 phone its daraz official warranty not samsung official warranty 100 pta compliance 1111 no warranty card no charging cableno adopter ab pata nahi chalne me kia rang dekhai ga allah kher kare but delivered in time  same as shown phone tou kaafi acha hai aur delivery bhi bilkul time par thi aur packaging bhi seller ne achi ki hoi thi lekin jou new phone ke dabbe par plastic sheet hoti hai woh nhi thi phone par tou usska seller bas yeh confirm kardein ke yeh bikul new tha na excellent quality     this product but charger nhi diya compney walo na mobile kafi acha best budget phone is price me or kia chahye  warranty ki wese b zrort ni prti samsung phones m mere khyal m daraz pe is s achi koi deal nhi h mobiles segment me in 30k budget phone original ha official pta approved ha colour maroon mangwaya tha seller na black bheja anyway cover maroon la lia packing b fit ha delivery buht slow th got this phone in 28419 price which is value for money excellent experience with this seller got original product sealed and received on time 1010 official pta approved dual sim uae version box sealed packed with samsung seal good set in this price range  2 years warranty recommended,Positive
2,this is the initial review the phone is the same as showngood thing is that it is managed directly by daraz packaging was amazing order came 1 day late only daraz is very helpfuli was not have enough money to buy this range mobile so i buy on installment from daraz mobile ki look boht achi hy or is range mai best hythanks daraz and seller camera satisfactory nh ha baki mobile ok ha daraz is very helpfuli was not have enough money to buy this range mobile so i buy on installment from daraz mobile ki look boht achi hy or is range mai best hythanks daraz and seller very good price comparison to infinix note 30 pro which black market launch price 61k whereas selling it on 95k product is good well packed and everything included orignal product satisfied with the service delivery was on time the phone is very good and in good price delivery was fast phone box was wrapped in bubble wrap so it was safe satisfied with the seller authentic product in good price  lightweight camera is 50mp but quality is not that good camera rating 710 user interface is very versatile face id recognition is not as expected 710 at night in ful darkness it has difficultly in recognition speaker sound is good excellent quality pta approved fast delivery received less than 24 hours of order very good service fast delivery same as shown in photo original product delivered within 2 days after use of 3 days mobile was good but warranty card is missing where is warranty card mera oder monday ko aa gaya tha review aj kr raha hu use kr k mujay bht acha discount mila hai jo device color mangwaya tha wahi milha hai or may full happy and satisfied hu thanks daraz thanx seller  good quality fast delivery thanks for seller good quality i am very happy from quick deliveryproper packing and mobile outlook its very attractive its touch very smooth bot kamal ka cell ha ma ne 3rd order kia ha or 2 or order kru ga or fast delivery thi 3 aug 2023 ko order or 4 aug 2023 ko mil bi gya to good umeriqbal1023gmailcom,Positive
3,received as promised almost 1010 condition genuine phone with genuine parts no issue found thanks will buy again in shaa allah,Positive
4,alhamdulillah same recieved as shown in picture same specifications a1 condition and fast delivery thanks daraz i recmond it and i order one more achhi packing but charging adapter was normal no handsfree no protector no mobile cover baqi use kr ke pta chalay ga dekhnay nice hai mobile is just go0d average in use bettery timing is go0d camera is just average overall ghar use k lia thek hai jaha bs call waghaira k lia instmal hota ho i upgraded my stand by phone from a1 to a2 i received this phone in great packaging delivery was fast phone seems a little better than a1 i wish it would have type c charging im surprised to see the camera quality display and battery timing of this phone a perfect phone in this range with very few compromises highly recommended assalamu alaikum thank god  thanks daraz team  wanderseller xiaomi good packing  short delivery time original product 100 recommended khushe hai ke aazadi sale mai itny best price main redmi a2 offer kiya gya thanks daraz app i recently ordered a phone  and i must say it was a convenient experience the website had a userfriendly interface making it easy to browse and compare options placing the order was straightforward and they provided clear shipping information the phone arrived in good condition and on time overall a hasslefree online phone shopping experience received my order the product is very good i am satisfied with daraz and the seller response is good but lcs service is poor due to not deliver my parcel to me not to inform me and delivered my parcel any other address very good quality and design mobile is genuine and working fine so far delivery was quite quick and i received the mobile next day of ordering price was competitive with market thank you daraz genuine product and good cell phone in this range  got at the lowest price through hbl mega deal   properly packed and timely delivered  satisfied with the seller   cheers   1111 awesome   original product in this price range the best of the best mobile mi redmi a2 plus 364 thumbs up  is price range may use mobiles ya refurbish mobile milty hain to kun apnay pasay zaya karain use or refurbish mobile lay kar jab mi redmi day raha hay brand new box pack mobile mi redmi a2 plus 364 bhot hi kaam price may  kmallllll hi hogyaaaahrgiz b ni lgta tha k daraz sy mob b itny best milty hainfirst time daraz sy kuch mngaya wo b direct mob mnga liya or drr tha k paisy gay mery lekin boht zbrdst mob mil gya seller boht honest hai bhiiii thank you or delivery boy ny to kmal hi krdiya time sy pehly hi delivery krdi assalamualaikum i placed the order fearing not to be scammed but thanks to allah the experience was good but it is a good mobile at this price thanks to the seller and the drawer app  authentic and genuine product good packing but badly handled by daraz i guess delivered within timeline highly recommend seller thank you so much alhamdulillah same recieved as shown in picture same specifications a1 condition and fast delivery thanks daraz i recmond it and i order one more excellent product and original one i bought it in 1111 sale 1111 is valuable for money saving awesome discount i get and original product i receive very fast delivery services xiaomi is doing very very good as always and daraz done it again very awesome sale thank you daraz and xiaomi ,Positive
5,acha mobile hai and same cheez delivered ki hai with fast delivery service satisfied with daraz and seller i bought many mobiles from daraz aj tak koi b mobile kharab nhe nikla thanks daraz for maintenance of trust with customers love from rawalpindi allahamdolilah received mobile is original and new as mentioned recommended for buying same thing which is ordered rather late delivered nice mobile at this price with special specs delivered late but overall services by daraz are good thanks i received my parcel two days ago genuine products hai aur time pr delivered hua dill khush ho gia cell dekh kr thank you so much bhai buht acha phone ha original phone one year official warranty ha  1111 no doubt the phone is worth buying  color is awesome and the specs are too good i hope it will continuously perform as it is doing now i was afraid before buying as there was no any review about this phone on this seller but thanks for sending me original device real mobile set with complete box having wire charger wireless charger jack pin with non active phone set this is non active mobile set i really very happy thanks dear bahot acha mobile hy thanks daraz and seller pin packed and original product recommended seller good packing arrived at time but mic ka problem lagta hai awaz agay bohat kam jati hai subah tak daikhta ho nai tu return kar du ga nice product i ma really happy to buy from daraz and thank you seller pin packed product i am really confused to buy this but amazing product  you should also believe the saller and daraz recommended seller awesome product,Positive
6,i get the mobile its pta approved but made of vietnam also its doesnt have charger thats the negative point  get the mobile on discounted rate in 1111  hopefully it will work for a long time  phone was brand new box packed came in secure packagingcant see the pta sticker but seller said it is approved so i believe seller words got this in just rs26419 while market price is still rs30000 thanks to daraz 1111 exactly same as described delivered in just 2 days its my 4th cell phone purchase from daraz amazing experience as always yr bht he sasta mila sale mai market mai 35 ka hai 128gb or wholesale mai bhi 31 se kam mai nahi hai or dosra non active hai vip hogia mene online check kia hai original packing mai tha thanks bhai jan buhat acha mobile hai 100 original products thanks daraz thanks seller mobile is the same as shown in the picture original product charger not available in the boxsatisfied with the product but delivery was far away from expectations 1111 pta approved device received safely mobile battery was low and required charging before getting on thank you thank you daraz and seller pta pro but charging adaptor nahi nikla nice  good mobile but delivery is to slow over all is very good no charger no warranty card no any back cover only one mobile pta approved hai online warranty new set okay scene hai best mobile phone very good,Positive
7,highly recommend,Positive
8,phone is damaged from edges pictures uploaded same as described original product found in reasonable price than market seller is fraud he is sending redmi 12c instead of redmi note 12 darazpk should take action on this in last 1 week multiple reviews came from buyers as they have received wrong product fortunately i have recorded video while opening my parcel i have attached video evidence i hope darazpk will take immediate action and compensate the buyers on priority i will never order from this store again genuine product as shown most reasonable price on daraz even any mobile market 1111 good and pin packed mobile thanks seller and daraz no any fault 1111 ordered grey colour but received green green is also a very good colour product is very good the price is also very reasonable as compared to the market same as described original product found in reasonable price than market nice phone camera results awesome  thanks  good product  colour black kaha tha but green mila anyway so nyc colour fade so beautiful so elegant just looking like a waooo mashallah fully packed phone haii delivery fast recomended thank you best purchase of the year so far great refresh rate and works seamlessly hope i can upgrade to the pro version timely received no damage good experience  product is good and reasonable delayed delivery brand new and perfectly packed satisfied,Positive
9,acha set hai battery timing bhe thk hi hai or sath mai original charger bhe hai sirf 1 din bad parsel mila official pta aprove h ye shayed with out warranty hoty h andar mp ki bajay itel ka warranty card h but phone achha h thnx thanks bro ju oder kiya tha wohi same cheez mili thanks daraz thank you so much  best keybad mob in a reasonable price battery timing is to good fully recommended excellent service the seller is a very good person the product is also very good the delivery boys are not good parcel jan boj kr late diya the seller delivered as per order thanks good product 100 original tnks seller nice product product achi nai the is liya return ke hai ma mobile ma speaker phata howa awaz bilkul sahi nai hai is liya return kiya bad experience with this seller     ,Positive
10,its 128 gb variant not available in pakistan but the seller has amazingly provided it the product is genuine received well packed and timely deievered thanks to seller and daraz mobile is pta aproved moible is very good this mobile was only available on daraz in market it is not available the crated goes to daraz i bought it on 38919 rupess 8 128 i hope it is a good price 1111 to cut the long story short all is well and of fine quality really satisfied with each and every single thing 1111 the product was same as was expected although delivery got very late but wait was worth it mobile was pin packed and pta approvedthanks a lot i have received my phone in time new and original condition best seller best service thank you daraz for best services origional product pta approved hai non activated phone tha sim dal k active kiya warranty 1 year activate hui ha at first i was worried by reading some negative comments but origional product rcvd 5 stars to seller  i have received original product and i would like to purchase anything anytime with the seller again as i mentioned before this is a daraz exclusive 128gb version which is not available in the offline market thank you so much thanks seller alhamdulillah satisfied and at a great discount as well in 1111 very nice phone comes with charger screen protector back cover charging is really fast and battery last around 2 days i think its the best phone in this price if you are not into camera that much 1111 this phone is amazing very fast speed,Positive
11,excellent  pin pack device with mega discount in 1111 1111 seller is honest daraz has become a life patner thanks daraz thanks tecno pakistan mobil is little bit slow camera result average seller is not cooperating but product received is well packed and as per mentioned specifications tecno spark 10 pro  original mobile pta approved sealed pack box pack with all accessories thank and love u daraz and seller  mobil is little bit slow camera result average seller is not cooperating but product received is well packed and as per mentioned specifications at least i recieved my phone its awesome phone features also best camera   battery life too good smart and weight less phone  recommended after using for few days i found this phone very recommended under such price     100       13             1111                                  very good mobile phone  tecno spark 10 thanks daraz bohat acha mobile hai or bilkul thek aya hai ot time pe aya hai theens daraz it is my 1st experience for purchase mobile online and im glad with that experience i received same what i ordered it is highly recommend by me 1010 1111 same as shown very beautiful handset will appreciate tecno for design so far working fine mobile is genuine but not used yet but look wise awesome very beautiful very elegant just like a wow  received before time nice phone in this price range,Positive
12,totally satisfied with my purchase i got good value for money and will definitely buy from them again the phone is in perfect condition and is a genuine product 1111,Positive
13,original set and pta approved set hai boht hi aala mobile hai mat forest green color hai actual price of mobile was rs45000 but i ordered during daraz 1111 sale and i got in rs42000 by availing two discount vouchers daraz ny mobile buy karny ki bhi tension dur kar di hai ghar bethy original mobile wo bhi market sey low price mein thanks darazpk 1111 jitni tareef kru utni kam hy mashallah aj tak ka sab se behtareen or aala qism ka mobile hy meri review hy 1010 mashallah so happy  product quality is amazing and reached safe at doorstep seller is really cooperative and friendly in communication recieved product as it is reflected on daraz original product 100 gebuin however around rs2000 costly than physical market prices should be aligned to the market rate to eradicate price manipulation overall satisfied with product quality but not satisfied with delivery and product price delivery little bit late but all ok pta approved 1 year warranty non active phone im not happy with such a phatic service by daraz if you cant bear workload dont put silly ideas like 1111 1111 original mobile and also reasonable price thank daraz and seller very good and amazing mobile excellent seller and always good from daraz product quality is amazing and reached safe at doorstep seller is really cooperative and friendly in communication recieved product as it is reflected on daraz original product 100 gebuin however around rs2000 costly than physical market prices should be aligned to the market rate to eradicate price manipulation overall satisfied with product quality but not satisfied with delivery and product price order k 1 week k bad parcel dispatch kia tha very slow service but product is fine and original pta approved very good experiencedelivered in timegenuine product by vivi flagship store very best mobile no repack and no damage product very best first time i ordered this much amount of order from daraz and alhamdolillah it went well recommend best phone masha allah good quality phone timely delivered only thing is i asked for purple but got in green otherwise phone is good very nice phone in this price range the only issue is that hand free not found in box,Positive
14,very very beautiful mobile i very happy price b okkthanks daraz and seller thanku awesome mobile recieved on time very fast processor lovely color seller are very cooperative totally satisfied  thank you daraz kam price m achi chiz saller bht acha h mobile bht acha h jaisa dikha waisa paya very very beautiful mobile i very happy price b okkthanks daraz and seller thanku its fantastic very beautiful mobile and seller is very honest mara purana phone ka camera ka result harab ha lakin jasi cheez dikhi wasi hi mili jasi products dikhayi wasi hi ayi nyc bro thanks daraz and seller use kr ka chk kiya ha boht acha ha mbl phone delivery time hui ha colour boht pyra ha thanks seller wow what a phone im surprised when i saw this phone infinix has no competetion with spark neo7 ultra its an amazing phone very impressive and build quality in this price range top class specialy camera believe u will be very happy to buy this phone dnt think read my coment and order it  thanks for comfortablr and safe service it was good experience seller is also cooperative recommended person i ordered blue colour received yellow colourbaki phone to ok hai market price sy kafi sasta mila1111 sale sy pin pack hi bahjathank u darazthank u seller  the mobile is exact as shown in advertisement received a little bit late but that was the problem of tcs im satisfied thanks seller thanks daraz im vhappy bohut acha mobile ha jesa dikhaya ha wessa hi ha im satisfiedthanks draz thanks dealer superb excellent beautiful mobile received great feel seller is responsive and cooperative thankyou seller and daraz quick and safe delivery product is ok,Positive
15,very fast delivery and origional sealed pack mobile i am satisfied   2023        not recommended not a good set camera not goodtouch very poor performance also poor charger not included in box be careful allhamdullilah  very good mobile recieved on time good features but only concern is warranty because seller is not properly guiding about that   2023        very nice mobile with fast delivery by daraz buhat acha experience hy amazing choice of phonenin this price range currently bcz i used note 20 ultra before this and now using this a14 not big differencebof performance in this price phone was well packed and new untouched so dont hesitate to buy samsung a14 6128 very satisfied with the delivery time and packaging this was a gift to my mother and she is really happy it is a good phone in the price range and delivery was very fast thank you first experience to purchase cellphone at this platform i am satisfied with the seller and also delivery service as i just received within 2 days willing to purchase more in future  quality is good but the saller didnt send changing adopter only send cable which is out of mind that why he send mobile without charging adopterthe packing and only cable video attached delivery on time full packed and safe 1010 bhot achi thi ap logo ki sarvice or shukariya ap ka k ap ne time pr apna order humhy diya awesome set and outstanding delivery service,Positive
16,same as shown and works well four stars because other sellers on daraz are selling it at rs200 less which i found out after i placed the order otherwise the phone is working fine and the seller was quick in responding and sent the correct colour thank you so much daraz and seller mobile boht pyara hai aur jo color oder kia wohi hai thanks daraz and seller  masha allah bahout khubsorat hi jaisa dekha seam waisa hi mila mashallah jo dikhaya ha wohi byja ha so nice mobile with box delivery zara late hoi baki mobile box pack tha sir mujeh bs ye baat achi nahi lagi k mobile ki asal qeemat to yehi hai jitne me aap logo ne mobile dia mgr aap logo ne 5999 ko cut kr k ye btane ki jhoti koshish ki k hum discount de rahe hen mgr aisa bilkul nahi hai this is very good thanks you nice ha yar same as shown and works well four stars because other sellers on daraz are selling it at rs200 less which i found out after i placed the order otherwise the phone is working fine and the seller was quick in responding and sent the correct colour mashallah aone keep it up very fast delivery achha mobile h thnx excellent mobile and package was also good nice mobile value for money bht achi hai mob complete satisfy good device and good seller good service same color without hand free  charger original performance allah kary achi ho gi thanks for good commitment good luck ,Positive
17,it was an absolutely amazing experience ordered on the 17thoctober night and got it around 01pm afternoon on 18thoctober in less than 12 hours as far as the product is concerned samsung is always a great experience as i have been a user of it since the beginning of the android era back in 2010 thanks daraz and seller for extreme level service daraz is a highly recommended ecommerce platform of pakistan from 2016 to till date never disappointed me with services perfect packing timely delivery original product 100 authentic excellent experience highly recommended for those who afraid to buy costly items online  thanx seller n daraz excellent  genuine product  thanks seller  thanks daraz  awesome mobile excellent service by                                   i am very happy the phone is great and delivered within 2 days thanks orginal stuff satisfied genuine sealed product warranty started after i started using it 1st very good online experience on mobile always check authentic brand verified from daraz very satisfied mobile is very good thnku seller n daraz overall very satisfied with the a24 its quite responsive and has worked flawlessly thus far it is pta approved and arrived in fully packed and sealed condition genuine product with warranty 1111 received good mobile received package it was great but didnt receive a charger in box pack best product best seller best timing of delivery with best price thank you seller you delivered it with in 12 hours hats off,Positive
18,original product very good price seal packed very good packing arrived safely highly recommended parcel received safely and on time  original phone and its working very good honest seller thank you so much and will order again in future  thank you daraz  highly recommend thank you for delivering me the best smart android phone in pakistan daraz is very good for shopping from others shopping applicationsagain thank you nice product nice seller service nice delivery service thanks u buddy thanks daraz amazing experience  thank you for delivering me the best smart android phone in pakistan daraz is very good for shopping from others shopping applicationsagain thank you outclass mobile  prefect highly recommended good original box packed ordered jazz digit 4g e2 pro alhumdulillah best experience with seller best price  best pakaging  best rider delivery on time jazakallah its great sorry cant upload picture but its amazing he is happy to have this cell fon saler k mobile buhat achay hotay hain packing b buhat achi hay but delivery buhat late hy fast delivery  and buhat achi cheez hai especially for non pta phones users  sir yeh mobile tu bht acha lekin battery timing bht km hai,Positive
19,awesome conditionvery light and tiny scratch91 percent battery,Positive
20,very good phone and colour combination is soo pretty and magic voice and every thing soo good daraz thanks so this phone achi chiz he mashallah bhot hi acha mobile he jo seller ne dekhaya tha pic mein wohi bheja hethanks daraz very nice boht zyada acha hy thank you so much nice product  recommended thanks daraz thanks seller hahah so cute meri finger jitna he well i wasnt expecting k itna chota phone bhe ho skta he overall best he excellent quality deliver in time thank u seller thank you draz this is my second parcel from same store mobile phone  is working very well  nice  good mini phone best voice quality very good product shokar he is dafa wohi bheja jomangwaya thalekin size bohat chota heheer jazakallah zabrdast bohat acha fone hai i like this mobile good product  good ,Positive
