ID,Reviews,Review Analysis
22,original product packing for logistics was excellent delivered on first promised day took 4 days to deliver a standard time price slight higher than company declared price and market price but its ok in case of 0installments thanks to the seller for the phone the same as i ordered the same color keeps your trust to people but guarantee card is missing i ordered one more same mobile with an other number received my package today good looking mobile in this price tag received just in one day looks good  very nice and good mobile in this price range and its my first experience very good experience honest seller the product was same as shown delivery little bit late but the seller 100 recommend original product and super fast delivery within 18 hours good seller thanks daraz same product jo btaya wohi delivere kia delivery service boht fast hy good xiaomi no 1 world choice nice fone big battery charging type c honi chahia thi seller responded on time sent earlier and received well 5 star for good experience received my package today good looking mobile in this price tag amazing parcel jesa dekhaya gya wesa hi aya zabardsht  fully certifies best box was damaged and not well packed set is working fine so far and product is original cant comment if its not repacked as not aware how to check original product pta approved before time recieved recomended,Positive
23,mobile was repacked there was no company seal when i confirmed from mi service center they confirm that mobile was repacked and was activated 11 days before purchasing date and this shop owner have assured me and other customers that mobile is not repacked and you will activate for the first time they lied and they are selling the product at increased price from official price but we have comprised on price that they will give us seal pack product but they scammed us and given us a repacked product which was activated before purchasing nice mobile delivery in time thanks for seller thank you draz and thank you seller bohat acha mobile hy or same colour jo order kia tha bohat acha seller hy over all very nice and good experience delivered phone same as shown in picture product delivered with in the time period given thanks daraz and seller for keeping our trust first experience for buying mobile phone from daraz good mobile phone with reasonable price seller is very cooperative recommended seller  like every time this time also the experience was very good and i received the delivery on time thank you daraz honest seller geniun product same as shown pta approved 1111 offer benefit very low price thanks daraz 5 stars original product and sealed bus delivery time zyada laga tha may be due to 11 11 its quite nice product and original and the delivery time was also affable very good mobile phone                       received sealed pack same as ordered satisfied original product at good price satisfied with the productthanks to draz,Positive
24,1  look  design phone is awesome in look very beautiful design feels like premium flagship 2 performance  satisfactory 3 battery  awesome 4 front camera average 5 back camera  good but not excellent 6 over all  value for money recommended this item                      i like the product its non active device and nicely company packed i always order from your store  thanks i received samecolor as i want i like the product its non active device and nicely company packed i always order from your store  thanks i received samecolor as i want                      product was delivered within two days alhamdolillah i received the same phone as they promised i was worried about the delivery of the product but the seller was very cooperative thankyou again i am unable to share my phones pictures because i captured them from my old phone and unfortunately its battery is dead the reason i bought this phone i would definitely recommend people to buy from alhamdolillah traders co they are trusted  from dera ismail khan trusted vendor responsive well packed received in a very good condition a very beautiful mobile phone havent used yet but hope it would work great thanks seller i give 5 star rating on this product the seller is very cooperative honest friendly and has fast delivery service give me the original product same as show in add thanks seller and thanks daraz so i ordered white color accidentally but mene seller ko chat me kh dia k mugha green chahiya and he said ok but seller ne bhi galti se white bhj dia jb mugha deliver hua to mene unse contact kia and unho ne mugha replace krna ki offer ki k ap is shop pr ja kr clr change krwa le amazing after sales and the product i got is genuine box packed bat acha mobhil phone ha good service ha aor fast delivery ha thank you draz and seller  seller i had a remarkable experience with this seller they were highly responsive and my order arrived in just 4 days faster than the estimated 1014 days the phone was brand new pta approved and wellpackaged phone impressive the phone is excellent it excels in camera quality touch sensitivity screen resolution and speed all receiving a perfect 1010 rating the only drawback is the 5000mah batterys faster drain honest seller and a good one seller should dispatch the phone on next working day or in 2 days mine was dispatched a bit later but thankfully leopard didnt take much time to deliver i collected it myself on saturday else could have been monday yar boht jaldi receive hwa boht acha mob mila boht he acha banda ha yar jis na bajha boht respect sa bat karta hain or reply bi fast ha or jo kuch kah doo bai kar deta boht trusted banda ha 3rd mob ha jo is bai sa order karwa raha hamesha original mila masha allah allah inhain kamiyab kara ameen orignal mobile phone pta approved non acctive fast delivery service thanks for seller and daraz online shopping got my phone i am already a fan of daraz satisfaction level infinity,Positive
25,zabrdast mobile hy original packing k sath markeet me final 39000 ka mil raha tha daraz se 36500 ka mila hy thnkew daraz thanks daraz original device in a low price and deliver safely on time keep it up best mobile good and save and fast delivery on time thank you selar thank you daraz buht hi acha experience raha market se buht hi discounted price pr buy kiya and also delivered within one day happy with purchase it was worth it the mobile phone is original and really good in performance and it is really recommended the only thing missing is that we didnt get any warranty card in the box product is made in pakistan however it is of good quality bohat hi aala phone hey  thanks to seller and daraz best product best seller service thanks draz best mobile good and save and fast delivery on time thank you selar thank you daraz very good product seller response is appreciated well packed and in time delivery thank u i want to thanks samsung very much for this smartphone its awesome and affordable genuine seller fast delivery same product delivered shown in pictures reccomended excellentgot the desired product as it was ordered zabrdst rate bhe acha servicr bhe achi it is very wonderful gadget,Positive
26,reciceved it in 3 days good mobile original no damage to the product original charger was also in the box recommended seller unbeatable price by seller very co operative seller but very late answering  overall 1010 thank you to daraz platform product is original and as per details given delivered well before the committed time good presentable packaging delivery is safe and soundrecommended the saller product is original and as per details given delivered well before the committed time good presentable packaging delivery is safe and soundrecommended the saller unbeatable price by seller very co operative seller but very late answering  overall 1010 thank you to daraz platform very good seller at daraz storei am satisfied with this order and recommend this seller very good and fast mobile thanks daraz very nice good quality mobile average price rom 128gb very good seller original product zaberdast 1010 bht acha mobile hye very nice product mgr charger kharab hye  bht zabardast mobile hye bht manasab qeemat perfect delivery time  reciceved it in 3 days good mobile original no damage to the product original charger was also in the box recommended seller i am very happy to receive my ordered mobile phone which has arrived safe and sound received as described thanks the delivery service and seller service both were terrible the seller didnt even respond to my msgs but the product is good,Positive
27,amazing phone within the discounted price of 1111 i would recommend everyone if you are looking to get the basics done alright and dont want to spend too much this is the right choice quality is not cheap like other phones in this budget however i do have one complaint as the phone down have a case in the box and no warranty card 1111 i am using this mobile for 5 days now best mobile for basic tasks like whatsapp call youtube etc i received it on 1111 sale at price 15k which is too good deal everyone appriciate its look working smooth and battery timing is too good  received brand new box packed mobile quality seems to be good performance is also fine excellent product original and value for money excellent mobile excellent service excellent response time to time thanks for everything recommended you all guys who are just thinking for buyingwant to give 10 stars am so glad to have this beautiful product received brand new box packed mobile quality seems to be good performance is also fine excellent product original and value for money many thanks daraz team and same specs as in description and mobile is very well its surprise gift to my mother and she is very happy after getting this  beautiful cell original honor x5 seal peck nice products nice quality fast delivery sir mene 1111 sale men lia ha wahan hbl bank se pay krne par 15000 ka show horha tha lekin mere ap ne 16609 kate ha ye kya msla ha mene hbl bank se he pay kia tha plz muje apny 1500 wapis karega thx delivery late mili hai muj koproduct is good aur daikhta hai ismaal kar k ab wase tu sahi lag raha hai mashallah bhoot acha phone ha or as price ma bhoot he best ha thanks bahi allah pak khouss rhky ap ko it is good but the final feedback should be given after the use of the product for a few weeks quality is awesome n in this price is the best option 100  genuine thanks to draz reached safely with outstanding paking beautiful set amazing product timely delivered highly recommend,Positive
28,recently acquired the infinix note 30  impressed with its overall performance the shipment exceeded expected delivery time though there was a color discrepancy ordered black received gray will share detailed performance feedback after more use appreciate daraz team for their service great phone and in same condition box packed sealed orrigional accessories everything is great but delivery was not good by leopard they tell that delivery is not in that area mashallah phone tu great ha budget friendly value for money packing company packing mei tha seal pack sound system jbl company ka ha sound la jawab ha 1010 for seller and for phone 108 thankyou alhamdulillah trading co for delivering phone fast and on time they delivered box packed genuine product businesses like alhamdulillah trading co are reason to trust ecommerce keep up the good work looking forward to do business again great phone and in same condition box packed sealed orrigional accessories everything is great but delivery was not good by leopard they tell that delivery is not in that area asslaam u alaikum  thanks to seller after my order i received phone in 50 hrs very fast service of daraz  selleri got phone in genuine conditiongod bless u brother very nice mobile infnix note 30 quality is amazing colour osam thanks draz appreciation for daraz and seller placed order and recieved in less than 24 hrs fast and safe delivery thumbs up  very good phone in this budget very sleek design good battery  graphics and performance best quality original product seller is cooperative delivery was on time product quality is as shown in the photos packing was not upto the mark seller is requested to properly pack the mobiles ill definitely buy from this seller in future main nay infinix note 30 horder kia black colour main ma sha allah bhut acha sat ha use krnay mei like this thanks to draz its a wonderful cell phone everything is in good condition packing is good recommended seller mashallah phone tu great ha budget friendly value for money packing company packing mei tha seal pack sound system jbl company ka ha sound la jawab ha 1010 for seller and for phone 108 mobile is fine but terrible delivery experience 1st they updated wrong status that address not found  after making multiple complaints i was asked to visit their office for order pickup  also had to visit twice bcz they were unable to find parcel on the 1st day of visit,Positive
29,aslamo alikum dear consumer buhat acha phone quality best ha sound level ha flash light bhi zabrdast bettry timing bhi kamal ki ha welljo ma ne blue colour order kia tha wo he mujhe received howa or fast service  delivery k sath or in ka rate kafi sallers se munasib or kam ha thanks you draz  sellers amazing product deliver on time working good using from a week good battery timing good display sound and call quality is awesome thanks daraz acha mobile ha 2 week se use kr rha seller bhe cooperative ha time py delever howa ha battery timing achi ha thanks daraz nice seller sent the exact phone thank you time py delever ho gaya jo mangwaya tha wohi aya thank you seller acha phone ha battery timing bhe achi ha speaker bhe thanks for daraz and seller nice phone thank you daraz bht hi acha mobile daraz ki service bi bht achi hai     ,Positive
30,mobile bht acha hy jesa dkhaya gia hy light on ni ho rhi btn loose ho gi hy shaid open krty hoy hm sy ho gia mbl condition is very very good seller service is very good me issakhel sy hoon or idhar delevry bht late aati hy 10 12 din me best mobile aor same cheez jo dekhiye gayi  thanks daraz and seller nice product and im stified thanks draz thanks saller                                thanks alot 1111 acha hai hand free 7 hoti to r b zaberdast hota boht acha mobile hey thank u daraz received same as ordered mobile acha gfive company ka hysirf headphone ka point nai overall set bht acha hy thank daraz and seller this is very good product in original pta approved thanks daraz good quality amazing  mobile phone thank you daraz very good nice product and im stified thanks draz thanks saller excellent than battery ki shape change thi  ,Positive
31,97 battery scratch less excellent condition just like new,Positive
32,very bad product bettry health is very bad within 2 days bettry health 80 sy 75 ai faulty iphone hy,Negative
33,intehai ghatia tareen mobile bhja h seller ny battery timing aik ghnta b ni veryyyy bad seller so happy to get so cute mbl and its same as shown in pic very satisfied yar pehle aik mangwaya tha who sahi tha is me masla he band hojaraha he very nice intehai ghatia tareen mobile bhja h seller ny battery timing aik ghnta b ni veryyyy bad seller yar pehle aik mangwaya tha who sahi tha is me masla he band hojaraha he         ,Positive
34,assalam u alaikum received before due date original productpacking was a little poor  but seller is coprativeit was my first purchase on installment happy to get it on 0 mark up the seller was very cooperative and delivered the phone in just 3 days upon my request the phone is just perfect and everything what i was looking for same as described amazing packing and received just in 2 days highly recommend the seller was very cooperative and delivered the phone in just 3 days upon my request the phone is just perfect and everything what i was looking for masha allah jo select kia tha wohi same received huwa hai aur bohat fast delivery hui hai thanks seller  received within two days same as shown in advertisement absolutely amazing product and 5 star to all service 1price 2genuine product 3daraz discount n vouchers 4 delivery time 5seller response 6bank voucher and installment on 0 percent markup all these things help me to get this amazing mobile at roughly 47000 which is less then market thanks all amd amazing daraz sale 1111 same as described amazing packing and received just in 2 days highly recommend jo mng waya tha wohi hai thnkz daraz original product and timely dilevered great packaging great product and received before the mentioned before delivery date the seller is so cooperative will definitely shop again from this seller thanks good product is as per specification and absolutely original received next day of ordering great response by seller  seller is highly recommended thanks and well done draz and seller v good seller shipped very fast original product received original phone everything was ok delivered on time,Positive
35,received original product of redme seller response very good and early satisfied  mobile to pinpack hai jaldi bi ponch aya laikn delivery walo ne us adress pe nahi ponchaya jo adress dia tha balke call kr ke inform kia gaya or kaha gaya k a ke khud le jaye jiske ko laine k kiye mujhe 12 km dor ja ke kaina para bht afsos howa is bat pe great mobile fast charging bhi nahi hai and no glass no cover best for my rayyan ali khan great mobile fast charging bhi nahi hai and no glass no cover best for my rayyan ali khan excellent thanks for delivering in quick time i request for mint color in chat but received blue other wise good reasonable price delivery  products quality is very good i recommend to any one who interested mashallah nice mobile bhot acha mobile received hoa hai gorgeous phone better than anticipated bht achi cheez bheji hy in time jo color btaya wo he send kiya thanks acha phone ha mashaallah good product  this is my 3rd phone from the seller and im much satisfied with the quality and sellers response they are so helpfulland got the phone before its delivery time the product is very good and im happy to see it thanks to daraz and the seller,Positive
36,mobile ki packing bhi achi haor original sumsang ki packing ki halat ma received howa ha dil khush kar diya daraz ki service na nice cell phone delivered safely but 1 thing is shameful that no adopter with mobile at this heavy price only data cable found in the box  great services by daraz thanks a lot daraz for their phenomenal service and a great discount of 5000 the device is very reasonablekeeping the current situation of the inflation i would highly recommend this over all other chinese brands the look and feel of the device is awesome same like the flagship series of samsung and performance is also acceptable overall the only drawback being the charger not included with the device which adds another couple of thousand to the already inflated price but still i like the phone thanks again daraz for providing the great experience and service thanks a lot daraz  placed order on 14 sep and received on 16 september in afternoon packaging was intact sealed box received without any damage it was a wonderful experience mobile ki packing bhi achi haor original sumsang ki packing ki halat ma received howa ha dil khush kar diya daraz ki service na the samsung a14 is a solid choice for those seeking a budgetfriendly smartphone with 4gb of ram and 128gb of storage it handles daily tasks with ease and provides ample space for apps and media the devices performance is snappy and it runs apps smoothly the camera quality is good for the price range and the battery life is impressive if youre looking for a reliable smartphone with a balance of performance and storage the samsung a14 wont disappoint aoa main daraz sy phly bhi orders krta hun but is order py mujy bohat kushi hui ha kun k ya order mujy diy gy time sy phly hi mill gya main is sy kush hua aor time py mari zarort puri ho gai aor mujy zada wait ni krna para product bhi theak hasame as company paking thanks allah hafiz original product box packed  thanks daraz  v goood same as described original phone hai aur colour b same bejhi hai thanks seler and daraz very fast service selar and orignal products and same color thanks daraz time pr deliver hua ek dum fit and non active phone ha and markt se discount pr mila the packing of the mobile was very good the mobile was sent with great carei took the mobile on but my full amount has been chargedi request you to solve this problem its original samsung phone but no charging adopter available in box 1111 1111 amazing product and packaging though as mentioned by company there is no charger with this product,Positive
37,i just mistake to select colour silver colour zarorat tha grey kar dia but mobile and saler response is to good excellent saler 1111 good mobile i like it the design is really good highly recommend for these type or price range phones overall its a good one 99 satisfied very good mobile beautifu and battery timing is excellent everything is equal thank you daraz this is a true and honest seller anyone who wants to buy this product can buy it without hesitation the price is also reasonable the design is really good highly recommend for these type or price range phones overall its a good one phone bhot pyara h mashallah sa 100  satisfied speaker sim slots all are perfect masah bhot acha ha battery timing kamaal ha seller repsonse b acha rha mobile b same wesa he nikla jesa socha tha pics ni ly ska totally satisfied with the seller and product  very good mobile phone under this range plastic body thi metal nhi overall very niceeee thkx daraz mobile bhoat acha hai bohot acha fone hai best quality nice product intact package a good service good ,Positive
38,mashallah 1111 sale received safe packed pta approved dilivered in time response excellent great quality satisfied original item received thanks seller and daraz  quality is good original product non activated  1111 brand new pin packed good quality got in 20000 only made in pakistan seller recommended  1111 brand new pin packed good quality got in 20000 only made in pakistan seller recommended i loved the phone its orignal n sealed brand new phone thank you seller excellent phone at a very cheap price on 1111 sale hbl deal good product delivered with seal pack thanks daraz good product well packed  11 11 amazing discount finally received happy new packed 1111 great outclass  same as shown 1111 original mobile with all sealed pta approved recommended  bohat acha hy original  ok set no active seller bahi boaht aala phone  acha hy jo btya wo diya im soo happ original product at a very reasonable price i bought an 1111 sale in 20000 on hbl maga deal i am so happy,Positive
39,mobile bahot acha hai 8 gb ram h aor rom 128 gb hain software normal lag ra h camera theek h overall ais price m zabardast chiz h saller bahot acha bnda h main nay usy msg kr kr bht tang kya  lkn saller nay mjhy hr bar reply di thank you daraz and thank you saller it is the best product and the original as i have advertised i have got no two opinions you also order you will like daraz and service is also good and the thing is also cute and has come with absolutely good awesome products and original spark phone with box and charger and warranty crad thank you daraz slam or thanks daraz bhot hi service ha 1din phly hi parsl rcve ho gay ha save packing kay shat bhot hi ache device ha 2din use kry ky bad bhe koi isu ni aya again thanks daraz seller ko 11 november order dia tha aor 13 november ke 4 baje order book kia tha delivery to time se agai lekin kafi jaldi thi mobile kiis waja se seller ko jaldi krni chahye thi over all experience was good achi chez bheji koi gift bhejte to kafi acha lagta but no way thnx alot zabrdast amazing  thank you so much for this owesome mobile bht hi alla saller is very coprative yeh bnda waky hlal kma rha hai  i am satisfied with the product n recommended received as shown good quality ordered again for my mother also original product received before estimated date satisfied with seller  thank you seller jo chez mangwaya wae mila hai shokurya baqii delivery ponchaney waley ne bahot tang kia tsc walooon a good product and a good seller at the same timethe product was better than expected seller is also active and guidance is also recommended the delivery was also on time and the packaging was also good thanks seller product is wellgood but delivery method via leopard is so bad they not delivered at time and at the end we collect our product from leopard head office very bad experience for me thanks daraz thats great deal phone  is very good and affordable price pakistani manufactured phones are really stepping up nice mobile good performance amazing experience and safe packing,Positive
